{
  "contractVersion": "0.3",
  "id": "op-fx-m3",
  "revision": "o-m3-1",
  "parentRef": null,
  "resourcePools": [
    {
      "id": "pool-forklift",
      "resourceType": "forklift",
      "count": 1,
      "capabilityRef": "cap-forklift-std",
      "availableWindowSec": 3600,
      "homeInstanceIds": [],
      "skillTags": ["certified"]
    }
  ],
  "serviceParameters": {
    "travelSpeedMps": 1.2,
    "emptySpeedMps": 1.5,
    "processSec": { "pick": 10, "ship": 5, "full_pallet": 10 }
  },
  "routingPolicy": { "kind": "shortest_path" },
  "shiftWindow": { "startSec": 0, "endSec": 3600 },
  "faults": [
    {
      "faultType": "edge_block",
      "enabled": true,
      "startTime": 100,
      "duration": 60,
      "targetEdge": "e-demo"
    }
  ]
}
